{
  "type": "object",
  "properties": {
    "schema_version": {
      "const": 1
    },
    "id": {
      "type": "string",
      "minLength": 1
    },
    "kind": {
      "enum": [
        "synthetic",
        "physical",
        "source_derived",
        "sanitized"
      ]
    },
    "format": {
      "enum": [
        "hid_report_hex",
        "evdev_trace_json"
      ]
    },
    "path": {
      "type": "string",
      "minLength": 1
    },
    "sha256": {
      "type": "string",
      "pattern": "^[0-9a-f]{64}$"
    },
    "sources": {
      "type": "array",
      "items": {
        "type": "string",
        "minLength": 1
      },
      "uniqueItems": true
    },
    "experiments": {
      "type": "array",
      "items": {
        "type": "string",
        "minLength": 1
      },
      "uniqueItems": true
    },
    "parent": {
      "type": [
        "string",
        "null"
      ]
    },
    "transform": {
      "type": [
        "string",
        "null"
      ]
    },
    "claims": {
      "type": "array",
      "items": {
        "type": "string",
        "minLength": 1
      },
      "uniqueItems": true
    }
  },
  "required": [
    "schema_version",
    "id",
    "kind",
    "format",
    "path",
    "sha256",
    "sources",
    "experiments",
    "parent",
    "transform",
    "claims"
  ],
  "additionalProperties": false,
  "$schema": "https://json-schema.org/draft/2020-12/schema"
}
