{
  "schema_version": 1,
  "id": "wii-c5-neutral-37",
  "kind": "synthetic",
  "format": "hid_report_hex",
  "path": "fixtures/wii-c5-neutral-37.hex",
  "sha256": "96b41fb1d829b0894d86486ba3a8e4d382e792709045bb9d7946813932749d73",
  "sources": [
    "wii-c5-datareport-cpp",
    "wii-c5-camera-cpp"
  ],
  "experiments": [],
  "parent": null,
  "transform": null,
  "claims": [
    "wii-c5-report-layouts",
    "wii-c5-synthetic-fixtures",
    "wii-c5-camera-no-points"
  ]
}
